{
  "contract": "clavenar.hil-notification-lifecycle/v1",
  "schema_version": 1,
  "event": "hil_notification",
  "phase": "trigger",
  "status": "pending",
  "notification_id": "12345678-1234-4123-8123-123456789abc:trigger",
  "dedup_key": "12345678-1234-4123-8123-123456789abc",
  "headline": "pending approval",
  "pending_id": "12345678-1234-4123-8123-123456789abc",
  "correlation_id": "12345678-1234-4123-8123-123456789abd",
  "agent_id": "payments-agent",
  "method": "tools/call",
  "tenant": "acme",
  "state_namespace": "tenant:acme",
  "created_at": "2026-07-26T12:00:00Z",
  "decided_at": null
}
